{
  "schema_version": "1.0",
  "generated_at": "2026-07-05T00:19:44Z",
  "data_status": "real",
  "methods": {
    "zscore": {
      "threshold": 3.0,
      "count": 990,
      "share_pct": 0.66
    },
    "isolation_forest": {
      "contamination": 0.02,
      "count": 3021,
      "share_pct": 2.0
    },
    "overlap_count": 232
  },
  "records": [
    {
      "ts": "2025-02-04T12:30:00Z",
      "country": "Greece",
      "lat": 37.9795,
      "lon": 23.7162,
      "temp_c": 11.2,
      "z": -1.065,
      "if_score": -0.5945,
      "detected_by": "isolation_forest"
    },
    {
      "ts": "2026-01-02T08:15:00Z",
      "country": "Macedonia",
      "lat": 42.0,
      "lon": 21.4333,
      "temp_c": -9.6,
      "z": -3.25,
      "if_score": -0.5269,
      "detected_by": "zscore"
    },
    {
      "ts": "2025-11-24T08:15:00Z",
      "country": "Belgium",
      "lat": 50.6,
      "lon": 4.1333,
      "temp_c": 5.4,
      "z": -1.674,
      "if_score": -0.598,
      "detected_by": "isolation_forest"
    },
    {
      "ts": "2024-07-17T21:45:00Z",
      "country": "North Korea",
      "lat": 39.02,
      "lon": 125.75,
      "temp_c": 24.4,
      "z": 0.323,
      "if_score": -0.5973,
      "detected_by": "isolation_forest"
    },
    {
      "ts": "2025-01-09T11:30:00Z",
      "country": "Luxembourg",
      "lat": 49.6117,
      "lon": 6.13,
      "temp_c": 8.3,
      "z": -1.369,
      "if_score": -0.7131,
      "detected_by": "isolation_forest"
    },
    {
      "ts": "2026-02-20T12:00:00Z",
      "country": "Kazakhstan",
      "lat": 51.1811,
      "lon": 71.4278,
      "temp_c": -16.9,
      "z": -4.017,
      "if_score": -0.6146,
      "detected_by": "both"
    },
    {
      "ts": "2024-09-10T15:30:00Z",
      "country": "Iraq",
      "lat": 33.34,
      "lon": 44.39,
      "temp_c": 47.2,
      "z": 2.718,
      "if_score": -0.5971,
      "detected_by": "isolation_forest"
    },
    {
      "ts": "2024-12-25T12:15:00Z",
      "country": "Bulgaria",
      "lat": 43.3167,
      "lon": 24.7,
      "temp_c": 2.8,
      "z": -1.947,
      "if_score": -0.6636,
      "detected_by": "isolation_forest"
    },
    {
      "ts": "2024-12-21T05:45:00Z",
      "country": "Canada",
      "lat": 45.4167,
      "lon": -75.7,
      "temp_c": -8.3,
      "z": -3.114,
      "if_score": -0.5404,
      "detected_by": "zscore"
    },
    {
      "ts": "2024-10-23T09:30:00Z",
      "country": "Iceland",
      "lat": 63.365,
      "lon": -20.2075,
      "temp_c": 6.0,
      "z": -1.611,
      "if_score": -0.6302,
      "detected_by": "isolation_forest"
    },
    {
      "ts": "2024-11-17T16:45:00Z",
      "country": "Mongolia",
      "lat": 47.9167,
      "lon": 106.9167,
      "temp_c": -9.6,
      "z": -3.25,
      "if_score": -0.5946,
      "detected_by": "both"
    },
    {
      "ts": "2025-05-20T12:00:00Z",
      "country": "Kuwait",
      "lat": 29.3667,
      "lon": 47.96,
      "temp_c": 39.9,
      "z": 1.951,
      "if_score": -0.62,
      "detected_by": "isolation_forest"
    },
    {
      "ts": "2026-02-18T07:45:00Z",
      "country": "Sweden",
      "lat": 59.3333,
      "lon": 18.05,
      "temp_c": -10.9,
      "z": -3.387,
      "if_score": -0.5334,
      "detected_by": "zscore"
    },
    {
      "ts": "2024-12-08T16:15:00Z",
      "country": "Kyrghyzstan",
      "lat": 42.8731,
      "lon": 74.6003,
      "temp_c": -5.6,
      "z": -2.83,
      "if_score": -0.6257,
      "detected_by": "isolation_forest"
    },
    {
      "ts": "2024-08-14T12:30:00Z",
      "country": "Liberia",
      "lat": 6.31,
      "lon": -10.8,
      "temp_c": 23.9,
      "z": 0.27,
      "if_score": -0.6379,
      "detected_by": "isolation_forest"
    },
    {
      "ts": "2025-03-09T19:45:00Z",
      "country": "Papua New Guinea",
      "lat": -9.4647,
      "lon": 147.1925,
      "temp_c": 24.1,
      "z": 0.291,
      "if_score": -0.6323,
      "detected_by": "isolation_forest"
    },
    {
      "ts": "2024-11-15T17:00:00Z",
      "country": "Mongolia",
      "lat": 47.9167,
      "lon": 106.9167,
      "temp_c": -12.9,
      "z": -3.597,
      "if_score": -0.6138,
      "detected_by": "both"
    },
    {
      "ts": "2024-11-23T10:45:00Z",
      "country": "Latvia",
      "lat": 56.95,
      "lon": 24.1,
      "temp_c": -0.6,
      "z": -2.304,
      "if_score": -0.5972,
      "detected_by": "isolation_forest"
    },
    {
      "ts": "2024-09-21T11:00:00Z",
      "country": "Sierra Leone",
      "lat": 8.49,
      "lon": -13.23,
      "temp_c": 26.2,
      "z": 0.512,
      "if_score": -0.6173,
      "detected_by": "isolation_forest"
    },
    {
      "ts": "2024-06-14T15:00:00Z",
      "country": "Ireland",
      "lat": 53.33,
      "lon": -6.25,
      "temp_c": 16.3,
      "z": -0.529,
      "if_score": -0.5993,
      "detected_by": "isolation_forest"
    },
    {
      "ts": "2025-04-03T05:00:00Z",
      "country": "Canada",
      "lat": 45.4167,
      "lon": -75.7,
      "temp_c": 1.2,
      "z": -2.115,
      "if_score": -0.6951,
      "detected_by": "isolation_forest"
    },
    {
      "ts": "2024-07-19T15:30:00Z",
      "country": "Iraq",
      "lat": 33.34,
      "lon": 44.39,
      "temp_c": 46.1,
      "z": 2.603,
      "if_score": -0.606,
      "detected_by": "isolation_forest"
    },
    {
      "ts": "2025-12-29T10:00:00Z",
      "country": "Jordan",
      "lat": 31.95,
      "lon": 35.9333,
      "temp_c": 7.3,
      "z": -1.474,
      "if_score": -0.6737,
      "detected_by": "isolation_forest"
    },
    {
      "ts": "2025-01-02T22:00:00Z",
      "country": "Solomon Islands",
      "lat": -9.4333,
      "lon": 159.95,
      "temp_c": 24.5,
      "z": 0.333,
      "if_score": -0.6485,
      "detected_by": "isolation_forest"
    },
    {
      "ts": "2025-07-14T20:45:00Z",
      "country": "Tuvalu",
      "lat": -8.5167,
      "lon": 179.2167,
      "temp_c": 28.2,
      "z": 0.722,
      "if_score": -0.6415,
      "detected_by": "isolation_forest"
    },
    {
      "ts": "2025-04-04T19:15:00Z",
      "country": "Papua New Guinea",
      "lat": -9.4647,
      "lon": 147.1925,
      "temp_c": 24.0,
      "z": 0.281,
      "if_score": -0.6246,
      "detected_by": "isolation_forest"
    },
    {
      "ts": "2024-06-28T16:15:00Z",
      "country": "Syria",
      "lat": 33.5,
      "lon": 36.3,
      "temp_c": 39.3,
      "z": 1.888,
      "if_score": -0.5984,
      "detected_by": "isolation_forest"
    },
    {
      "ts": "2026-04-05T10:30:00Z",
      "country": "Azerbaijan",
      "lat": 40.3953,
      "lon": 49.8822,
      "temp_c": 11.2,
      "z": -1.065,
      "if_score": -0.5906,
      "detected_by": "isolation_forest"
    },
    {
      "ts": "2024-09-09T12:30:00Z",
      "country": "Guinea",
      "lat": 9.51,
      "lon": -13.71,
      "temp_c": 23.2,
      "z": 0.196,
      "if_score": -0.6194,
      "detected_by": "isolation_forest"
    },
    {
      "ts": "2026-03-28T07:45:00Z",
      "country": "Liechtenstein",
      "lat": 47.1333,
      "lon": 9.5167,
      "temp_c": -11.4,
      "z": -3.439,
      "if_score": -0.5629,
      "detected_by": "zscore"
    },
    {
      "ts": "2024-08-15T18:15:00Z",
      "country": "Kyrghyzstan",
      "lat": 42.87,
      "lon": 74.6,
      "temp_c": 28.2,
      "z": 0.722,
      "if_score": -0.6482,
      "detected_by": "isolation_forest"
    },
    {
      "ts": "2024-07-31T15:15:00Z",
      "country": "Saudi Arabia",
      "lat": 24.64,
      "lon": 46.77,
      "temp_c": 43.5,
      "z": 2.33,
      "if_score": -0.6183,
      "detected_by": "isolation_forest"
    },
    {
      "ts": "2024-12-26T23:00:00Z",
      "country": "Tonga",
      "lat": -21.1333,
      "lon": -175.2,
      "temp_c": 26.3,
      "z": 0.522,
      "if_score": -0.6161,
      "detected_by": "isolation_forest"
    },
    {
      "ts": "2024-07-10T20:00:00Z",
      "country": "Thailand",
      "lat": 18.78,
      "lon": 100.78,
      "temp_c": 27.3,
      "z": 0.627,
      "if_score": -0.615,
      "detected_by": "isolation_forest"
    },
    {
      "ts": "2024-07-02T16:15:00Z",
      "country": "Ethiopia",
      "lat": 9.03,
      "lon": 38.7,
      "temp_c": 19.7,
      "z": -0.171,
      "if_score": -0.61,
      "detected_by": "isolation_forest"
    },
    {
      "ts": "2024-12-07T11:30:00Z",
      "country": "Netherlands",
      "lat": 52.374,
      "lon": 4.8897,
      "temp_c": 10.2,
      "z": -1.17,
      "if_score": -0.6161,
      "detected_by": "isolation_forest"
    },
    {
      "ts": "2025-11-25T08:30:00Z",
      "country": "Switzerland",
      "lat": 46.6167,
      "lon": 9.9833,
      "temp_c": -2.9,
      "z": -2.546,
      "if_score": -0.6109,
      "detected_by": "isolation_forest"
    },
    {
      "ts": "2024-08-05T18:30:00Z",
      "country": "Bangladesh",
      "lat": 23.72,
      "lon": 90.41,
      "temp_c": 28.8,
      "z": 0.785,
      "if_score": -0.6195,
      "detected_by": "isolation_forest"
    },
    {
      "ts": "2026-04-08T06:30:00Z",
      "country": "Iceland",
      "lat": 64.15,
      "lon": -21.95,
      "temp_c": 6.0,
      "z": -1.611,
      "if_score": -0.7467,
      "detected_by": "isolation_forest"
    },
    {
      "ts": "2024-06-18T17:00:00Z",
      "country": "Iraq",
      "lat": 33.34,
      "lon": 44.39,
      "temp_c": 47.4,
      "z": 2.739,
      "if_score": -0.6381,
      "detected_by": "isolation_forest"
    },
    {
      "ts": "2024-06-23T01:45:00Z",
      "country": "Tuvalu",
      "lat": -8.52,
      "lon": 179.22,
      "temp_c": 25.1,
      "z": 0.396,
      "if_score": -0.5961,
      "detected_by": "isolation_forest"
    },
    {
      "ts": "2025-07-14T13:00:00Z",
      "country": "United Arab Emirates",
      "lat": 24.4667,
      "lon": 54.3667,
      "temp_c": 43.0,
      "z": 2.277,
      "if_score": -0.5897,
      "detected_by": "isolation_forest"
    },
    {
      "ts": "2025-08-01T11:15:00Z",
      "country": "Kuwait",
      "lat": 29.3667,
      "lon": 47.96,
      "temp_c": 45.9,
      "z": 2.582,